{
  "$schema": "https://json-schema.org/draft/2020-12/schema",
  "$id": "repo-health-doctor://schemas/execution-authorization.schema.json",
  "title": "repo-health-doctor execution authorization",
  "description": "Experimental human-controlled execution authorization artifact. 0.1-draft and 0.2-draft remain accepted for historical validation; 0.3-draft binds an immutable snapshot manifest in addition to image, gate, argv, policy, expiry, and Git subject fields. Gate decisions remain non-authorizing.",
  "type": "object",
  "required": [
    "authorization_kind",
    "schema_version",
    "approved",
    "approved_by",
    "approved_at",
    "expires_at",
    "approved_scope",
    "approved_argv",
    "approved_policy_version",
    "based_on_gate_decision",
    "subject",
    "limitations",
    "residual_risks"
  ],
  "properties": {
    "authorization_kind": {"type": "string", "enum": ["repo_health_execution_authorization"]},
    "schema_version": {"type": "string", "enum": ["0.1-draft", "0.2-draft", "0.3-draft"]},
    "approved": {"type": "boolean"},
    "approved_by": {"type": ["string", "null"]},
    "approved_at": {"type": ["string", "null"]},
    "expires_at": {"type": ["string", "null"]},
    "approved_scope": {"$ref": "#/$defs/approved_scope"},
    "approved_argv": {"type": "array", "items": {"type": "string"}},
    "approved_policy_version": {"type": ["string", "null"]},
    "based_on_gate_decision": {"$ref": "#/$defs/based_on_gate_decision"},
    "subject": {"$ref": "#/$defs/subject"},
    "limitations": {"type": "array", "minItems": 1, "items": {"type": "string"}},
    "residual_risks": {"type": "array", "minItems": 1, "items": {"type": "string"}},
    "approved_image": {"$ref": "#/$defs/approved_image"}
  },
  "additionalProperties": false,
  "allOf": [
    {
      "if": {"properties": {"schema_version": {"const": "0.1-draft"}}, "required": ["schema_version"]},
      "then": {"not": {"required": ["approved_image"]}}
    },
    {
      "if": {"properties": {"schema_version": {"const": "0.2-draft"}}, "required": ["schema_version"]},
      "then": {"properties": {"approved_image": {"$ref": "#/$defs/approved_image"}}}
    },
    {
      "if": {"properties": {"schema_version": {"const": "0.3-draft"}}, "required": ["schema_version"]},
      "then": {
        "properties": {
          "approved_scope": {"$ref": "#/$defs/snapshot_approved_scope"},
          "subject": {"$ref": "#/$defs/snapshot_subject"},
          "approved_image": {"$ref": "#/$defs/approved_image"}
        }
      }
    }
  ],
  "$defs": {
    "approved_image": {
      "type": "object",
      "required": ["requested_reference", "resolved_image_id"],
      "properties": {
        "requested_reference": {
          "type": "string",
          "pattern": "^[a-z0-9][a-z0-9./:_-]{0,255}@sha256:[0-9a-f]{64}$"
        },
        "resolved_image_id": {
          "type": "string",
          "pattern": "^sha256:[0-9a-f]{64}$"
        }
      },
      "additionalProperties": false
    },
    "approved_scope": {
      "type": "object",
      "required": ["repo", "commit", "tree_hash", "binding_kind"],
      "properties": {
        "repo": {"type": "string", "minLength": 1},
        "commit": {"type": ["string", "null"]},
        "tree_hash": {"type": ["string", "null"]},
        "snapshot_id": {"type": ["string", "null"], "pattern": "^sha256:[0-9a-f]{64}$"},
        "manifest_fingerprint": {"type": ["string", "null"], "pattern": "^sha256:[0-9a-f]{64}$"},
        "binding_kind": {
          "type": "string",
          "enum": ["unbound", "path_bound", "commit_bound", "tree_bound", "snapshot_bound", "synthetic"]
        }
      },
      "additionalProperties": false
    },
    "snapshot_approved_scope": {
      "allOf": [
        {"$ref": "#/$defs/approved_scope"},
        {
          "type": "object",
          "required": ["snapshot_id", "manifest_fingerprint"]
        }
      ]
    },
    "based_on_gate_decision": {
      "type": "object",
      "required": ["decision_kind", "schema_version", "verdict", "fingerprint"],
      "properties": {
        "decision_kind": {"type": "string", "enum": ["repo_health_gate_decision"]},
        "schema_version": {"type": "string", "enum": ["0.1-draft"]},
        "verdict": {
          "type": "string",
          "enum": ["allow_limited", "warn", "quarantine", "block", "unknown"]
        },
        "fingerprint": {"type": "string", "pattern": "^sha256:[0-9a-f]{64}$"}
      },
      "additionalProperties": false
    },
    "subject": {
      "type": "object",
      "required": ["repo", "commit", "tree_hash"],
      "properties": {
        "repo": {"type": "string", "minLength": 1},
        "commit": {"type": ["string", "null"]},
        "tree_hash": {"type": ["string", "null"]},
        "snapshot_id": {"type": ["string", "null"], "pattern": "^sha256:[0-9a-f]{64}$"},
        "manifest_fingerprint": {"type": ["string", "null"], "pattern": "^sha256:[0-9a-f]{64}$"}
      },
      "additionalProperties": false
    },
    "snapshot_subject": {
      "allOf": [
        {"$ref": "#/$defs/subject"},
        {
          "type": "object",
          "required": ["snapshot_id", "manifest_fingerprint"]
        }
      ]
    }
  }
}
